{
  "profile_id": "PROF-F02-FORM-B",
  "version": "1.0.0",
  "supersedes": null,
  "document_id": "F02-FORM-B",
  "display_name": "FSSAI Form B",
  "applicant_summary": "The signed Form B application you submit for an FSSAI State Licence.",
  "expected_identity": {
    "anchors_required": [
      {
        "text": "Form B",
        "weight": 3.0,
        "basis": "regulatory-documents/requirements/fssai.json F02-REQ-001 checklist_item 'Form B, signed in duplicate', verbatim"
      },
      {
        "text": "FSSAI Form B",
        "weight": 3.0,
        "basis": "regulatory-documents/specs/documents.json F02-FORM-B name, verbatim"
      },
      {
        "text": "FSSAI",
        "weight": 2.0,
        "basis": "regulatory-documents/sources/document_sources.json SRC-M4-FSSAI-001 authority, verbatim"
      },
      {
        "text": "FSS Act",
        "weight": 2.0,
        "basis": "engine-v3/regulatory/approvals/catalogue.json F-02 statute 'FSS Act, 2006 s.31(1)'"
      },
      {
        "text": "State Licence",
        "weight": 1.5,
        "basis": "regulatory-documents/specs/documents.json F02-FORM-B description 'Signed Form B application for State Licence'"
      },
      {
        "text": "State License",
        "weight": 1.5,
        "basis": "orthographic variant of the F02-FORM-B description"
      },
      {
        "text": "FoSCoS",
        "weight": 1.0,
        "basis": "regulatory-documents/sources/document_sources.json SRC-M4-FSSAI-001 title names the FoSCoS system"
      }
    ],
    "anchors_forbidden": [
      {
        "text": "Form No. 1",
        "weight": 2.0,
        "basis": "regulatory-documents/requirements/dish.json S02-REQ-001 checklist_item identifies a different evidence item"
      },
      {
        "text": "Factories Act",
        "weight": 2.0,
        "basis": "engine-v3/regulatory/approvals/catalogue.json S-02 statute denotes a different approval"
      }
    ]
  },
  "fields": [
    {
      "field_id": "document_identity_text",
      "field_source": "PROFILE_GROUNDED",
      "label": "Document title text found",
      "normalizer": "text",
      "basis": "Derived from the matched expected_identity anchors, each of which is repository-grounded above.",
      "sensitivity": "NON_SENSITIVE"
    },
    {
      "field_id": "issuing_context_text",
      "field_source": "PROFILE_GROUNDED",
      "label": "Authority named in the document",
      "anchors": [
        "FSSAI"
      ],
      "normalizer": "text",
      "basis": "SRC-M4-FSSAI-001 authority string in regulatory-documents/sources/document_sources.json.",
      "sensitivity": "NON_SENSITIVE"
    },
    {
      "field_id": "document_date",
      "field_source": "RESEARCH_REQUIRED",
      "label": "Date printed on the form",
      "anchors": [
        "Date",
        "Dated",
        "Date of application"
      ],
      "pattern": "(\\d{1,2}[/\\-.]\\d{1,2}[/\\-.]\\d{2,4}|\\d{4}-\\d{2}-\\d{2})",
      "normalizer": "date",
      "basis": "RESEARCH_REQUIRED. The repository records no field schema for Form B. The anchors are conservative guesses and are not authoritative.",
      "sensitivity": "DATE"
    },
    {
      "field_id": "applicant_name",
      "field_source": "RESEARCH_REQUIRED",
      "label": "Applicant or company name on the form",
      "anchors": [
        "Name of the Company",
        "Name of Applicant",
        "Name of the applicant"
      ],
      "pattern": "[:\\s]*([A-Za-z][A-Za-z0-9 .,'&\\-]{3,80})",
      "normalizer": "text",
      "basis": "RESEARCH_REQUIRED. No field label is recorded in the repository. Not used for any blocking finding.",
      "sensitivity": "PERSONAL_NAME"
    }
  ],
  "checks": [
    {
      "check_id": "F02FB-IDENTITY",
      "kind": "identity_anchor_present",
      "inputs": [
        "__identity__"
      ],
      "severity": "BLOCKING",
      "message": "The uploaded file does not contain the identifying text expected on FSSAI Form B.",
      "remedy": "Please upload the signed Form B for your State Licence application."
    },
    {
      "check_id": "F02FB-DATE-FORMAT",
      "kind": "date_well_formed",
      "inputs": [
        "document_date"
      ],
      "severity": "ADVISORY",
      "message": "A date was found but could not be read as a calendar date.",
      "remedy": "Check that the date on the form is legible."
    },
    {
      "check_id": "F02FB-DATE-FUTURE",
      "kind": "date_not_future",
      "inputs": [
        "document_date"
      ],
      "severity": "ADVISORY",
      "message": "The date read from this form is in the future.",
      "remedy": "Check the date entered on the form."
    }
  ],
  "thresholds": {
    "classification_min_score": 4.0,
    "classification_min_margin": 1.5,
    "max_pages": 50,
    "min_text_chars": 40
  },
  "authenticity": {
    "capability": "NOT_APPLICABLE_APPLICANT_AUTHORED",
    "explanation": "This is an application form completed by the applicant, not a certificate issued by an authority. There is no issuer to verify it against, so issuer authenticity does not apply to this document."
  },
  "human_review": {
    "always": false,
    "checklist": []
  },
  "provenance": {
    "author": "M5 slice 1",
    "created": "2026-08-30",
    "basis": "regulatory-documents/requirements/fssai.json (F02-REQ-001), regulatory-documents/specs/documents.json (F02-FORM-B), regulatory-documents/sources/document_sources.json (SRC-M4-FSSAI-001), engine-v3/regulatory/approvals/catalogue.json (F-02).",
    "notes": "Every anchor string is traceable to a repository file named in its own basis field.",
    "limitations": [
      "No specimen of the current FoSCoS Form B was available. No authoritative field schema exists in this repository.",
      "The checklist item says 'signed in duplicate'; M5 does not attempt to verify signing or duplication.",
      "applicant_name and document_date are RESEARCH_REQUIRED: their anchors are conservative guesses.",
      "Only the identity check is BLOCKING."
    ]
  }
}
